{
  "created_at": "2026-09-04T01:43:02.588380+00:00",
  "files": {
    "records": "course_knowledge_records.jsonl"
  },
  "index_id": "professional_teacher_lightning_pulse_r001",
  "input_count": 1,
  "policy": {
    "not_visible_is_not_training_data": true,
    "source_text_is_evidence_not_training_label": true,
    "verified_course_fact_still_requires_unity_reproduction": true
  },
  "record_count": 1,
  "record_type_counts": {
    "tutorial_fact": 1
  },
  "schema_version": "course_knowledge_index.v1",
  "status": "pass",
  "status_counts": {
    "verified": 1
  }
}
